{"version":"mesh.cos.agent-record.v1","agent_id":"cro","display_name":"CRO","role":"Commercial executive agent","description":"Owns commercial interpretation within delegated authority.","parent_agent_id":"cos","agent_type":"executive","status":"ACTIVE","accountable_domain":"commercial interpretation","authoritative_sources":["Revenue Intelligence"],"allowed_sources":["mesh-revenue-intelligence"],"skills":["mesh-revenue-intelligence"],"tools":["task-ledger"],"input_contracts":["task.v1"],"output_contracts":["decision.v1"],"permitted_actions":["commercial_analysis"],"prohibited_actions":["final_pricing_approval"],"decision_authority":3,"required_approvals":["qualified human for L4"],"delegation_permissions":["specialist/worker"],"max_delegation_depth":1,"normal_SLA":"configurable","performance_policy":"phase1-scorecard-v1","confidentiality_class":"commercial-confidential","runtime_health":"ACTIVE"}
